[
  {
      "delivered": 1.0,
      "end": "2014-03-07T07:18:02",
      "deliveryType": "scheduled",
      "inferred": true,
      "value": 1.0,
      "start": "2014-03-07T06:00:00",
      "type": "basal-rate-segment",
      "id": "8490c2ea-ea91-4324-9a16-87582b2bab73"
  },
  {
      "delivered": 0.65,
      "end": "2014-03-07T04:00:00",
      "deliveryType": "scheduled",
      "inferred": false,
      "value": 0.65,
      "start": "2014-03-07T02:00:00",
      "type": "basal-rate-segment",
      "id": "893dedf8-1d10-45dd-99c9-b79dcd516f32"
  },
  {
      "delivered": 0.75,
      "end": "2014-03-07T06:08:07",
      "deliveryType": "temp",
      "inferred": false,
      "value": 0.75,
      "start": "2014-03-07T01:08:07",
      "type": "basal-rate-segment",
      "id": "ccae81b6-6fa8-4501-9559-b6c4b9f5afc3"
  }
]
